{
  "$schema": "https://json-schema.org/draft/2020-12/schema",
  "$id": "https://example.com/context-engineering/schemas/bundle.schema.json",
  "title": "Canon bundle (export/bundle.json)",
  "description": "Everything in one file for single-fetch injection into prompts, evals and tools that cannot read a folder: the parsed contract plus every canonical page with its status, owner and citation URL. Generated by the sync, never edited. Reference: docs/formats.md section 5.",
  "$comment": "The contract is embedded as a plain object rather than referenced by $ref so this file can be validated standalone: the sync has already validated the contract against context-contract.schema.json or client-context-contract.schema.json, and a bundle may carry either. A page the sync could not read is present with available: false and an empty markdown body, so a consumer iterating the bundle sees the gap. Prompt builders should inject only pages whose status the contract allows (grounded, and draft only with the unconfirmed label) and should cite each page's url.",
  "type": "object",
  "additionalProperties": false,
  "required": ["generated_at", "contract", "pages"],
  "properties": {
    "generated_at": {
      "$ref": "#/$defs/isoDateTime",
      "description": "Same clock as meta.json.generated_at: when the exported content last changed. A prompt that embeds the bundle should state it ('canon as of ...')."
    },
    "last_synced_at": {
      "$ref": "#/$defs/isoDateTime",
      "description": "Optional copy of the heartbeat clock from meta.json for consumers that only fetch the bundle."
    },
    "contract_version": {
      "type": "integer",
      "minimum": 1,
      "description": "Optional copy of the contract version for consumers that only fetch the bundle."
    },
    "source_of_truth": {
      "type": "string",
      "enum": ["notion", "markdown", "confluence"],
      "description": "Optional copy of the contract's source_of_truth."
    },
    "content_hash": {
      "type": "string",
      "minLength": 1,
      "description": "Optional digest over the bundle's pages, matching meta.json.content_hash when both are present."
    },
    "contract": {
      "type": "object",
      "minProperties": 1,
      "description": "The parsed contract, verbatim, with dates serialised as ISO strings. Agents read instruction_authority and rules from here rather than from a separate file, so the bundle is self-governing."
    },
    "pages": {
      "type": "object",
      "propertyNames": { "pattern": "^[a-z][a-z0-9_]*$" },
      "additionalProperties": { "$ref": "#/$defs/page" },
      "description": "Every canonical page keyed by slug, in contract order. Keys match contract.canonical_pages exactly; the sync fails when a slug is missing here and absent from meta.json.pages_missing."
    }
  },
  "$defs": {
    "isoDateTime": {
      "type": "string",
      "format": "date-time",
      "pattern": "^[0-9]{4}-[0-9]{2}-[0-9]{2}T[0-9]{2}:[0-9]{2}:[0-9]{2}(\\.[0-9]+)?(Z|[+-][0-9]{2}:[0-9]{2})$",
      "description": "An RFC 3339 timestamp with explicit offset; the sync writes UTC with a Z suffix."
    },
    "page": {
      "type": "object",
      "additionalProperties": false,
      "required": ["title", "status", "owner", "review", "url", "available", "markdown"],
      "properties": {
        "title": {
          "type": "string",
          "minLength": 1,
          "description": "Human title of the page as it appears in the source. Display only; agents resolve pages by slug and id, never by title."
        },
        "status": {
          "type": "string",
          "enum": ["grounded", "draft", "stub", "deprecated"],
          "description": "Status copied from the contract at export time. Governs use: grounded may be asserted and cited; draft only when labelled unconfirmed; stub is never loaded as truth; deprecated is not used."
        },
        "owner": {
          "type": "string",
          "minLength": 2,
          "description": "The owner ROLE from the contract (owner in a business contract, owner_role in a client contract; the sync normalises both to owner here)."
        },
        "review": {
          "type": "string",
          "enum": ["monthly", "quarterly", "on_change"],
          "description": "Review cadence copied from the contract."
        },
        "url": {
          "type": "string",
          "minLength": 1,
          "description": "Citation URL: page_url_base + page id. This is the string agents put after a claim so a reader can check it."
        },
        "available": {
          "type": "boolean",
          "description": "false when the sync could not read the page on this run; the entry is kept so consumers notice the gap. When false, markdown is empty and the slug is listed in meta.json.pages_missing."
        },
        "markdown": {
          "type": "string",
          "description": "The page body as markdown, prefixed with the generated header (source, slug, status, owner, generated_at, caveat). Empty string when available is false."
        },
        "visibility": {
          "type": "string",
          "enum": ["company_internal", "client_private", "client_shared", "public"],
          "description": "Optional: the page's visibility, copied so an embedding job can filter pages without re-reading the contract."
        },
        "caveat": {
          "type": "string",
          "minLength": 1,
          "description": "Optional: the caveat string for the status (for example 'grounded: may be asserted and cited'), the same text the generated header carries."
        },
        "source_id": {
          "type": "string",
          "minLength": 1,
          "description": "Optional: the page id or path in the source system, useful when url is not resolvable offline."
        },
        "last_reviewed": {
          "type": "string",
          "format": "date",
          "pattern": "^[0-9]{4}-[0-9]{2}-[0-9]{2}$",
          "description": "Optional: last_reviewed from the page frontmatter, when the source carries one."
        },
        "next_review": {
          "type": "string",
          "format": "date",
          "pattern": "^[0-9]{4}-[0-9]{2}-[0-9]{2}$",
          "description": "Optional: next_review from the page frontmatter; the sync warns when it is in the past."
        }
      },
      "if": {
        "properties": { "available": { "const": false } },
        "required": ["available"]
      },
      "then": {
        "properties": { "markdown": { "maxLength": 0 } }
      }
    }
  }
}
