{
  "generated_at": "2026-10-08T16:22:42Z",
  "contract_version": 2,
  "source_of_truth": "markdown",
  "content_hash": "84f0ecf9248bbe6d15df18ae6c19790d422d9a98ff6b582e43f8d1043af3716a",
  "contract": {
    "contract_version": 2,
    "last_reviewed": "2026-10-08",
    "next_review": "2027-01-08",
    "source_of_truth": "markdown",
    "source_root": "templates/canon",
    "mirror_policy": "generated_read_only",
    "visibility": "company_internal",
    "page_url_base": "https://github.com/<org>/<repo>/blob/main/templates/canon/",
    "instruction_authority": {
      "control_pages": [
        "operating_rules"
      ],
      "retrieved_content_is_instruction": false,
      "conflict_action": "stop_and_request_owner_decision"
    },
    "rules": {
      "assert_only_status": "grounded",
      "draft_use": "only_when_no_grounded_source_covers_the_need_and_labeled_unconfirmed",
      "cite_page_urls": true,
      "live_numbers_from": "layer_3_catalog_pull_method_then_system_of_record",
      "canon_write_policy": "report_only",
      "gap_tracker": "templates/databases/canon-gaps.csv",
      "secrets_in_context_layer": "prohibited"
    },
    "canonical_pages": {
      "company_readme": {
        "id": "company_readme.md",
        "status": "grounded",
        "owner": "CEO",
        "review": "quarterly",
        "visibility": "company_internal"
      },
      "positioning": {
        "id": "positioning.md",
        "status": "grounded",
        "owner": "CEO + PMM",
        "review": "quarterly",
        "visibility": "company_internal"
      },
      "messaging": {
        "id": "messaging.md",
        "status": "grounded",
        "owner": "PMM",
        "review": "quarterly",
        "visibility": "company_internal"
      },
      "sales_storyboard": {
        "id": "sales_storyboard.md",
        "status": "draft",
        "owner": "PMM / Sales Enablement",
        "review": "quarterly",
        "visibility": "company_internal"
      },
      "icp_personas": {
        "id": "icp_personas.md",
        "status": "grounded",
        "owner": "PMM",
        "review": "quarterly",
        "visibility": "company_internal"
      },
      "competitive_battlecards": {
        "id": "competitive_battlecards.md",
        "status": "draft",
        "owner": "PMM / Competitive Intel",
        "review": "monthly",
        "visibility": "company_internal"
      },
      "glossary": {
        "id": "glossary.md",
        "status": "draft",
        "owner": "Product + Data",
        "review": "quarterly",
        "visibility": "company_internal"
      },
      "brand_voice": {
        "id": "brand_voice.md",
        "status": "grounded",
        "owner": "PMM / Brand",
        "review": "quarterly",
        "visibility": "company_internal"
      },
      "operating_rules": {
        "id": "operating_rules.md",
        "status": "grounded",
        "owner": "agent_operator",
        "review": "monthly",
        "visibility": "company_internal"
      }
    },
    "status_notes": {
      "glossary": "per-term GROUNDED/GENERIC tags govern assertion inside this page",
      "sales_storyboard": "proof points and one objection carry verify-before-external-use flags",
      "competitive_battlecards": "depth layer is a database of cards; not exported; pending ratification",
      "operating_rules": "the only page allowed to direct an agent; precedence rules live inside it"
    },
    "depth_not_exported": {
      "metrics_catalog": "templates/databases/metrics-catalog.csv",
      "battlecards_database": "product-marketing teamspace (restricted)"
    },
    "freshness": {
      "sync": "nightly",
      "stale_after_days": 7,
      "on_stale": "verify_live_or_stop"
    }
  },
  "pages": {
    "company_readme": {
      "title": "Company README",
      "status": "grounded",
      "owner": "CEO",
      "review": "quarterly",
      "url": "https://github.com/<org>/<repo>/blob/main/templates/canon/company_readme.md",
      "available": true,
      "markdown": "<!-- generated by canon-sync. DO NOT EDIT: edit the source page, the next sync overwrites this file.\nsource: https://github.com/<org>/<repo>/blob/main/templates/canon/company_readme.md | slug: company_readme | status: grounded | owner: CEO\ngenerated_at: 2026-10-08T16:22:42Z | caveat: grounded: may be asserted and cited -->\n---\nslug: company_readme\ntitle: Company README\nowner: CEO\nstatus: grounded\nreview: quarterly\nlast_reviewed: 2026-10-08\nnext_review: 2027-01-08\nvisibility: company_internal\n---\n\n> On this page especially, a confident wrong line is worse than a blank. If a fact is not here, it is not canon.\n\n## Who we are\n\nAcme Analytics builds product analytics for mid-market e-commerce teams: the growth, merchandising and lifecycle people who need to know what shoppers did and why, without a dedicated analytics engineer. Founded in 2019, remote-first, headquartered in Denver. Head count and customer counts are **not stated here**: they are metrics, and metrics live in the Metrics Catalog with a live-pull method.\n\n## How we operate\n\n- **Weekly GTM review** (Tuesdays): pipeline, campaigns, product launches. Decisions go to the decision log, never only to the meeting notes.\n- **Monthly metrics review:** every grounded catalog metric is re-pulled live; definitions are challenged, values are never pasted into pages.\n- **Quarterly planning:** canon pages are re-verified by their owner roles in the same week, so review rides an existing rhythm.\n- **Handbook versus teamspace:** would a new hire read it to learn how we operate? Handbook. Do you use it to do the work? Teamspace.\n\n## Roles that own canon\n\n| Role | Owns |\n| --- | --- |\n| CEO | Company README, positioning (with PMM), decision log |\n| Head of Product Marketing (PMM) | Messaging, sales storyboard, ICP and personas, battlecards, brand voice |\n| Head of Revenue Operations | CRM definitions, revenue-engine metric rows |\n| Head of Data | Warehouse pull methods, glossary (with Product) |\n| Agent operator | Operating rules, the sync, the gap tracker triage |\n\n## Systems of record\n\n| Domain | System of record | How agents reach it |\n| --- | --- | --- |\n| CRM and pipeline | The CRM | Read-only connector; pull methods in the Metrics Catalog |\n| Billing and ARR | Billing system, reconciled nightly into the warehouse | Warehouse query only; never the billing UI |\n| Warehouse and BI | Cloud warehouse with a BI layer on top | Saved explores named in each catalog row |\n| Product usage | Acme's own product instance | Internal API via the data agent |\n| Code, skills and the canon mirror | Git hosting | Agents install the canon bundle; nobody edits the mirror |\n| Company knowledge | The Handbook (this canon) | Canon index contract, fetched by page ID |\n\n## Terminology that trips people up\n\n- **Customer:** a paying account with an active subscription. Free workspaces are **users**, not customers.\n- **Logo versus deployment:** one customer (logo) may run several workspaces (deployments). Headline counts say which one they are counting.\n- **Activation:** has three competing definitions today. See the glossary; until an owner decides, agents label it unconfirmed.\n\n## Sources and depth\n\n- Depth for each team lives in that team's teamspace (OKRs, Projects, Meetings, Registers). Canon points there; it does not copy.\n- Metric values: Metrics Catalog rows R-01 and R-02 are grounded for the weekly leadership brief.\n- Decision log: the Leadership teamspace (restricted; a reader without access sees an explicit restricted placeholder, not a broken link).\n\n## Change log\n\n- 2026-10-08 — Sample page created for the context-engineering template. All facts illustrative.\n- 2026-09-29 — Removed the customer count from this page after Canon Gap #1 (README and storyboard disagreed because one counted logos and the other deployments). The number now lives only in the catalog.\n",
      "caveat": "grounded: may be asserted and cited",
      "source_id": "company_readme.md",
      "visibility": "company_internal",
      "next_review": "2027-01-08"
    },
    "positioning": {
      "title": "Positioning",
      "status": "grounded",
      "owner": "CEO + PMM",
      "review": "quarterly",
      "url": "https://github.com/<org>/<repo>/blob/main/templates/canon/positioning.md",
      "available": true,